{"bundle_digest":"cb2c9ee194b4eb4080d0c08727b4959edd5c61ff719f9b704fbd04ad03920edd","coverage":{"kind":"scope_digest","scope_digest":"3626a729e5132c2f75625c43359a863ed06a906b63361b7dc0a763a9057e9d06"},"limitations":["synthetic test review; no authority"],"outcome":"asserted_acceptable","purposes":["semantic_fidelity"],"review_id":"review:1","reviewed_at":"2026-09-13T00:00:00Z","reviewer":{"name":"Synthetic Reviewer","organisation":"none","reviewer_id":"reviewer:synthetic","role":"fixture"},"schema":"yuho.review-assertion/v1","scope_digest":"3626a729e5132c2f75625c43359a863ed06a906b63361b7dc0a763a9057e9d06"}